{
  "name": "Previewedtext@",
  "store": 0,
  "null_switch": "NOT NULL",
  "indexes": "0",
  "datadefault_other": "",
  "datadefault": "",
  "short_description": "Fixture: reuse Joomla TextField and append an escaped preview.",
  "datatype": "VARCHAR",
  "has_defaults": 1,
  "properties": {
    "properties0": {
      "name": "type",
      "example": "previewedtext",
      "mandatory": "1",
      "description": "Fixture custom type name. Confirm the compiled class and component field prefix."
    },
    "properties1": {
      "name": "name",
      "example": "sample_preview",
      "adjustable": "1",
      "mandatory": "1",
      "description": "Concrete field name."
    },
    "properties2": {
      "name": "label",
      "example": "Previewed title",
      "adjustable": "1",
      "mandatory": "1",
      "translatable": "1",
      "description": "Concrete field label."
    },
    "properties3": {
      "name": "extends",
      "example": "text",
      "mandatory": "1",
      "description": "The inspected Joomla 6 compiler maps this to TextField."
    },
    "properties4": {
      "name": "type_php_1",
      "example": "\t/**\n\t * Render Joomla's text input followed by an escaped value preview.\n\t *\n\t * @return  string\n\t */\n\tprotected function getInput()\n\t{\n\t\t$preview = htmlspecialchars((string) $this->value, ENT_QUOTES, 'UTF-8');\n\n\t\treturn parent::getInput()\n\t\t\t. '<p class=\"form-text\"><code>' . $preview . '</code></p>';\n\t}\n",
      "adjustable": "1",
      "mandatory": "1",
      "description": "Complete method inside the generated own-custom class body; not a nested method and not a whole PHP file."
    },
    "properties5": {
      "name": "filter",
      "example": "STRING",
      "adjustable": "1",
      "description": "Explicit filtering choice for the concrete field."
    },
    "properties6": {
      "name": "maxlength",
      "example": "120",
      "adjustable": "1",
      "description": "Suggested browser limit; choose storage and server validation independently."
    }
  },
  "description": "Original own-custom fixture. Its @ catalogue name selects the JCB own-custom generation path. The type_php_1 example contains a complete getInput method that delegates input rendering to Joomla TextField and appends an escaped preview. This metadata is not itself an installed Joomla class.",
  "datalenght": "Other",
  "datalenght_other": "128",
  "guid": "58d75b15-b4d8-4192-a8a7-19fac5881b0b"
}
